web_scraper_order,web_scraper_start_url,pagination,data,data2,data3,item_page_title,item_page_link
"1778828342-140","https://archive.ics.uci.edu/dataset/53/iris","","Normalization based K means Clustering Algorithm","By Deepali Virmani, Shweta Taneja, Geetika Malhotra. 2015","Published in ArXiv.","Normalization based K means Clustering Algorithm","https://api.semanticscholar.org/CorpusID:473748"
"1778828342-141","https://archive.ics.uci.edu/dataset/53/iris","","A new Initial Centroid finding Method based on Dissimilarity Tree for K-means Algorithm","By Abhishek Kumar, Suresh Gupta. 2015","Published in ArXiv.","A new Initial Centroid finding Method based on Dissimilarity Tree for K-means Algorithm","https://api.semanticscholar.org/CorpusID:1052460"
"1778828342-142","https://archive.ics.uci.edu/dataset/53/iris","","Fuzzy Clustering Using the Convex Hull as Geometrical Model","By Luca Liparulo, Andrea Proietti, Massimo Panella. 2015","Published in Adv. Fuzzy Systems.","Fuzzy Clustering Using the Convex Hull as Geometrical Model","https://api.semanticscholar.org/CorpusID:29454126"
"1778828342-143","https://archive.ics.uci.edu/dataset/53/iris","","FuGePSD: Fuzzy Genetic Programming-based algorithm for Subgroup Discovery","By Cristóbal Carmona, Pedro González, María Jesús. 2015","Published in IFSA-EUSFLAT.","FuGePSD: Fuzzy Genetic Programming-based algorithm for Subgroup Discovery","https://api.semanticscholar.org/CorpusID:18642289"
"1778828342-144","https://archive.ics.uci.edu/dataset/53/iris","","Designing Artificial Neural Networks Using Particle Swarm Optimization Algorithms","By Beatriz Garro, Roberto Vázquez. 2015","Published in Computational intelligence and neuroscience.","Designing Artificial Neural Networks Using Particle Swarm Optimization Algorithms","https://api.semanticscholar.org/CorpusID:14261256"
"1778828342-145","https://archive.ics.uci.edu/dataset/53/iris","","The Responsibility Weighted Mahalanobis Kernel for Semi-Supervised Training of Support Vector Machines for Classification","By Tobias Reitmaier, Bernhard Sick. 2015","Published in ArXiv.","The Responsibility Weighted Mahalanobis Kernel for Semi-Supervised Training of Support Vector Machines for Classification","https://api.semanticscholar.org/CorpusID:1369063"
"1778828342-146","https://archive.ics.uci.edu/dataset/53/iris","","Consensus Clustering Using kNN Mode Seeking","By Jonas Myhre, Karl Mikalsen, Sigurd Løkse, Robert Jenssen. 2015","Published in SCIA.","Consensus Clustering Using kNN Mode Seeking","https://api.semanticscholar.org/CorpusID:20016218"
"1778828342-147","https://archive.ics.uci.edu/dataset/53/iris","","The Responsibility Weighted Mahalanobis Kernel for Semi-Supervised Training of Support Vector Machines for Classification","By Tobias Reitmaier, Bernhard Sick. 2015","Published in ArXiv.","The Responsibility Weighted Mahalanobis Kernel for Semi-Supervised Training of Support Vector Machines for Classification","https://api.semanticscholar.org/CorpusID:1369063"
"1778828342-148","https://archive.ics.uci.edu/dataset/53/iris","","Fuzzy C-means++: Fuzzy C-means with effective seeding initialization","By Adrian Stetco, Xiao-Jun Zeng, John Keane. 2015","Published in Expert Syst. Appl..","Fuzzy C-means++: Fuzzy C-means with effective seeding initialization","https://api.semanticscholar.org/CorpusID:19206984"
"1778828342-149","https://archive.ics.uci.edu/dataset/53/iris","","MATRICIAL REPRESENTATION OF INDIVIDUALS IN CONTINUOUS GENETIC ALGORITHMS CAN IMPROVE THE EFFICIENCE IN RADIAL BASIS FUNCTIONS NEURAL NETWORKS TRAINING","By J. Mota, Paulo Siqueira, L. Souza. 2015","Published in International Journal of Pure and Apllied Mathematics.","MATRICIAL REPRESENTATION OF INDIVIDUALS IN CONTINUOUS GENETIC ALGORITHMS CAN IMPROVE THE EFFICIENCE IN RADIAL BASIS FUNCTIONS NEURAL NETWORKS TRAINING","https://api.semanticscholar.org/CorpusID:54708750"
"1778828342-150","https://archive.ics.uci.edu/dataset/53/iris","","Convalescing Cluster Configuration Using a Superlative Framework","By R. Sabitha, S. Karthik. 2015","Published in TheScientificWorldJournal.","Convalescing Cluster Configuration Using a Superlative Framework","https://api.semanticscholar.org/CorpusID:14450105"
"1778828342-151","https://archive.ics.uci.edu/dataset/53/iris","","The Responsibility Weighted Mahalanobis Kernel for Semi-Supervised Training of Support Vector Machines for Classification","By Tobias Reitmaier, Bernhard Sick. 2015","Published in ArXiv.","The Responsibility Weighted Mahalanobis Kernel for Semi-Supervised Training of Support Vector Machines for Classification","https://api.semanticscholar.org/CorpusID:1369063"
"1778828342-152","https://archive.ics.uci.edu/dataset/53/iris","","Consensus Clustering Using kNN Mode Seeking","By Jonas Myhre, Karl Mikalsen, Sigurd Løkse, Robert Jenssen. 2015","Published in SCIA.","Consensus Clustering Using kNN Mode Seeking","https://api.semanticscholar.org/CorpusID:20016218"
"1778828342-153","https://archive.ics.uci.edu/dataset/53/iris","","Pattern Recognition using the TTOCONROT","By César Astudillo, B. Oommen. 2015","Published in IEA/AIE.","Pattern Recognition using the TTOCONROT","https://api.semanticscholar.org/CorpusID:13222486"
"1778828342-154","https://archive.ics.uci.edu/dataset/53/iris","","Training Spiking Neural Models Using Artificial Bee Colony","By Roberto Vazquez, Beatriz Garro. 2015","Published in Computational intelligence and neuroscience.","Training Spiking Neural Models Using Artificial Bee Colony","https://api.semanticscholar.org/CorpusID:1531223"
"1778828342-155","https://archive.ics.uci.edu/dataset/53/iris","","The Mondrian Process for Machine Learning","By Matej Balog, Yee Teh. 2015","Published in ArXiv.","The Mondrian Process for Machine Learning","https://api.semanticscholar.org/CorpusID:14970651"
"1778828342-156","https://archive.ics.uci.edu/dataset/53/iris","","The Mondrian Process for Machine Learning","By Matej Balog, Yee Teh. 2015","Published in ArXiv.","The Mondrian Process for Machine Learning","https://api.semanticscholar.org/CorpusID:14970651"
"1778828342-157","https://archive.ics.uci.edu/dataset/53/iris","","Training Spiking Neural Models Using Artificial Bee Colony","By Roberto Vazquez, Beatriz Garro. 2015","Published in Computational intelligence and neuroscience.","Training Spiking Neural Models Using Artificial Bee Colony","https://api.semanticscholar.org/CorpusID:1531223"
"1778828342-158","https://archive.ics.uci.edu/dataset/53/iris","","Managing your Private and Public Data: Bringing down Inference Attacks against your Privacy","By Salman Salamatian, Amy Zhang, Flavio Calmon, Sandilya Bhamidipati, Nadia Fawaz, Branislav Kveton, Pedro Oliveira, Nina Taft. 2014","Published in ArXiv.","Managing your Private and Public Data: Bringing down Inference Attacks against your Privacy","https://api.semanticscholar.org/CorpusID:765881"
"1778828342-159","https://archive.ics.uci.edu/dataset/53/iris","","Further heuristics for $k$-means: The merge-and-split heuristic and the $(k,l)$-means","By Frank Nielsen, Richard Nock. 2014","Published in ArXiv.","Further heuristics for $k$-means: The merge-and-split heuristic and the $(k,l)$-means","https://api.semanticscholar.org/CorpusID:12696860"
"1778828342-160","https://archive.ics.uci.edu/dataset/53/iris","","Comparison and Weighted Summation Type of Fuzzy Cluster Validity Indices","By Kaile Zhou, Shuai Ding, Chao Fu, Shanlin Yang. 2014","Published in International Journal of Computers Communications & Control.","Comparison and Weighted Summation Type of Fuzzy Cluster Validity Indices","https://api.semanticscholar.org/CorpusID:56373150"
"1778828342-161","https://archive.ics.uci.edu/dataset/53/iris","","IOG - An Improved Approach to Find Optimal Grid Size Using Grid Clustering Algorithm","By Monali Parikh. 2014","Published in IOSR Journal of Computer Engineering.","IOG - An Improved Approach to Find Optimal Grid Size Using Grid Clustering Algorithm","https://api.semanticscholar.org/CorpusID:7120164"
"1778828342-162","https://archive.ics.uci.edu/dataset/53/iris","","Comparison and Weighted Summation Type of Fuzzy Cluster Validity Indices","By Kaile Zhou, Shuai Ding, Chao Fu, Shanlin Yang. 2014","Published in International Journal of Computers Communications & Control.","Comparison and Weighted Summation Type of Fuzzy Cluster Validity Indices","https://api.semanticscholar.org/CorpusID:56373150"
"1778828342-163","https://archive.ics.uci.edu/dataset/53/iris","","Gaussian Processes Autoencoder for Dimensionality Reduction","By Xinwei Jiang, Junbin Gao, Xia Hong, Zhihua Cai. 2014","Published in PAKDD.","Gaussian Processes Autoencoder for Dimensionality Reduction","https://api.semanticscholar.org/CorpusID:9715201"
"1778828342-164","https://archive.ics.uci.edu/dataset/53/iris","","The Hidden Convexity of Spectral Clustering","By James Voss, Mikhail Belkin, Luis Rademacher. 2014","Published in ArXiv.","The Hidden Convexity of Spectral Clustering","https://api.semanticscholar.org/CorpusID:11800861"
"1778828342-165","https://archive.ics.uci.edu/dataset/53/iris","","Generalized Framework for Similarity Measure of Time Series","By Hongsheng Yin, Honggang Qi, Jingwen Xu, William Hung, Xiaoyu Song. 2014","Published in Mathematical Problems in Engineering.","Generalized Framework for Similarity Measure of Time Series","https://api.semanticscholar.org/CorpusID:54817777"
"1778828342-166","https://archive.ics.uci.edu/dataset/53/iris","","Generalized Framework for Similarity Measure of Time Series","By Hongsheng Yin, Honggang Qi, Jingwen Xu, William Hung, Xiaoyu Song. 2014","Published in Mathematical Problems in Engineering.","Generalized Framework for Similarity Measure of Time Series","https://api.semanticscholar.org/CorpusID:54817777"
"1778828342-167","https://archive.ics.uci.edu/dataset/53/iris","","The Hidden Convexity of Spectral Clustering","By James Voss, Mikhail Belkin, Luis Rademacher. 2014","Published in ArXiv.","The Hidden Convexity of Spectral Clustering","https://api.semanticscholar.org/CorpusID:11800861"
"1778828342-168","https://archive.ics.uci.edu/dataset/53/iris","","A Bi-clustering Framework for Consensus Problems","By Mariano Tepper, Guillermo Sapiro. 2014","Published in ArXiv.","A Bi-clustering Framework for Consensus Problems","https://api.semanticscholar.org/CorpusID:14309250"
"1778828342-169","https://archive.ics.uci.edu/dataset/53/iris","","Learning ELM network weights using linear discriminant analysis","By Philip Chazal, Jonathan Tapson, Andr'e Schaik. 2014","Published in ArXiv.","Learning ELM network weights using linear discriminant analysis","https://api.semanticscholar.org/CorpusID:7263820"
"1778828342-170","https://archive.ics.uci.edu/dataset/53/iris","","Multivariate f-Divergence Estimation With Confidence","By Kevin Moon, Alfred Hero. 2014","Published in K.R. Moon and A.O. Hero III,""Multivariate f-Divergence Estimation With Confidence,""In Advances in Neural Information Processing Systems, pp. 2420-2428, 2014.","Multivariate f-Divergence Estimation With Confidence","https://api.semanticscholar.org/CorpusID:10487669"
"1778828342-171","https://archive.ics.uci.edu/dataset/53/iris","","A Bi-clustering Framework for Consensus Problems","By Mariano Tepper, Guillermo Sapiro. 2014","Published in ArXiv.","A Bi-clustering Framework for Consensus Problems","https://api.semanticscholar.org/CorpusID:14309250"
"1778828342-172","https://archive.ics.uci.edu/dataset/53/iris","","A new random approach for initialization of the multiple restart EM algorithm for Gaussian model-based clustering","By Wojciech Kwedlo. 2014","Published in Pattern Analysis and Applications.","A new random approach for initialization of the multiple restart EM algorithm for Gaussian model-based clustering","https://api.semanticscholar.org/CorpusID:11464503"
"1778828342-173","https://archive.ics.uci.edu/dataset/53/iris","","The Hidden Convexity of Spectral Clustering","By James Voss, Mikhail Belkin, Luis Rademacher. 2014","Published in ArXiv.","The Hidden Convexity of Spectral Clustering","https://api.semanticscholar.org/CorpusID:11800861"
"1778828342-174","https://archive.ics.uci.edu/dataset/53/iris","","Gaussian Processes Autoencoder for Dimensionality Reduction","By Xinwei Jiang, Junbin Gao, Xia Hong, Zhihua Cai. 2014","Published in PAKDD.","Gaussian Processes Autoencoder for Dimensionality Reduction","https://api.semanticscholar.org/CorpusID:9715201"
"1778828342-175","https://archive.ics.uci.edu/dataset/53/iris","","Data classification using the Dempster-Shafer method","By Qi Chen, Amanda Whitbrook, Uwe Aickelin, Chris Roadknight. 2014","Published in ArXiv.","Data classification using the Dempster-Shafer method","https://api.semanticscholar.org/CorpusID:13120572"
"1778828342-176","https://archive.ics.uci.edu/dataset/53/iris","","A Novel Naive Bayes Classification Algorithm Based on Particle SwarmOptimization","By Jun Li, Lixin Ding, Bo Li. 2014","Published in The Open Automation and Control Systems Journal.","A Novel Naive Bayes Classification Algorithm Based on Particle SwarmOptimization","https://api.semanticscholar.org/CorpusID:8286553"
"1778828342-177","https://archive.ics.uci.edu/dataset/53/iris","","Integrating type-1 fuzzy and type-2 fuzzy clustering with k-means for pre-processing input data in classification algorithms","By Vahid Nouri, Mohammad Akbarzadeh, Alireza Tootoonchi. 2014","Published in International Journal of Intelligent Information Systems.","Integrating type-1 fuzzy and type-2 fuzzy clustering with k-means for pre-processing input data in classification algorithms","https://api.semanticscholar.org/CorpusID:8864930"
"1778828342-178","https://archive.ics.uci.edu/dataset/53/iris","","Managing your Private and Public Data: Bringing down Inference Attacks against your Privacy","By Salman Salamatian, Amy Zhang, Flavio Calmon, Sandilya Bhamidipati, Nadia Fawaz, Branislav Kveton, Pedro Oliveira, Nina Taft. 2014","Published in ArXiv.","Managing your Private and Public Data: Bringing down Inference Attacks against your Privacy","https://api.semanticscholar.org/CorpusID:765881"
"1778828342-179","https://archive.ics.uci.edu/dataset/53/iris","","Convex Clustering: An Attractive Alternative to Hierarchical Clustering","By Gary Chen, Eric Chi, John Ranola, Kenneth Lange. 2014","Published in PLOS Computational Biology 11(5):e1004228, 2015.","Convex Clustering: An Attractive Alternative to Hierarchical Clustering","https://api.semanticscholar.org/CorpusID:645831"
"1778828342-180","https://archive.ics.uci.edu/dataset/53/iris","","Combining Multiple Clusterings via Crowd Agreement Estimation and Multi-Granularity Link Analysis","By Dong Huang, Jian-Huang Lai, Chang-Dong Wang. 2014","Published in Neurocomputing, 2015, vol.170, pp.240-250.","Combining Multiple Clusterings via Crowd Agreement Estimation and Multi-Granularity Link Analysis","https://api.semanticscholar.org/CorpusID:7797035"
"1778828342-181","https://archive.ics.uci.edu/dataset/53/iris","","3N-Q: Natural Nearest Neighbor with Quality","By Shu Zhang, Malek Mouhoub, Samira Sadaoui. 2014","Published in Computer and Information Science.","3N-Q: Natural Nearest Neighbor with Quality","https://api.semanticscholar.org/CorpusID:28023129"
"1778828342-182","https://archive.ics.uci.edu/dataset/53/iris","","Heart: a novel optimization algorithm for cluster analysis","By Abdolreza Hatamlou. 2014","Published in Progress in Artificial Intelligence.","Heart: a novel optimization algorithm for cluster analysis","https://api.semanticscholar.org/CorpusID:8470238"
"1778828342-183","https://archive.ics.uci.edu/dataset/53/iris","","A Comparative study Between Fuzzy Clustering Algorithm and Hard Clustering Algorithm","By Dibya Bora, Dr. Gupta. 2014","Published in International Journal of Computer Trends and Technology (IJCTT) V10(2):108-113, Apr 2014. ISSN:2231-2803.","A Comparative study Between Fuzzy Clustering Algorithm and Hard Clustering Algorithm","https://api.semanticscholar.org/CorpusID:18570347"
"1778828342-184","https://archive.ics.uci.edu/dataset/53/iris","","Learning ELM network weights using linear discriminant analysis","By Philip Chazal, Jonathan Tapson, Andr'e Schaik. 2014","Published in ArXiv.","Learning ELM network weights using linear discriminant analysis","https://api.semanticscholar.org/CorpusID:7263820"
"1778828342-185","https://archive.ics.uci.edu/dataset/53/iris","","Multivariate f-Divergence Estimation With Confidence","By Kevin Moon, Alfred Hero. 2014","Published in K.R. Moon and A.O. Hero III,""Multivariate f-Divergence Estimation With Confidence,""In Advances in Neural Information Processing Systems, pp. 2420-2428, 2014.","Multivariate f-Divergence Estimation With Confidence","https://api.semanticscholar.org/CorpusID:10487669"
"1778828342-186","https://archive.ics.uci.edu/dataset/53/iris","","Partitioning trees: A global multiclass classification technique for SVMs","By Ioannis Constantinidis, Ioannis Andreadis. 2014","Published in Artif. Intell. Research.","Partitioning trees: A global multiclass classification technique for SVMs","https://api.semanticscholar.org/CorpusID:19936484"
"1778828342-187","https://archive.ics.uci.edu/dataset/53/iris","","A Multi-Objective Evolutionary Algorithm Fitness Function for Case-Base Maintenance","By Eduardo Lupiani, Susan Craw, Stewart Massie, Jose Juarez, José Palma. 2013","Published in ICCBR.","A Multi-Objective Evolutionary Algorithm Fitness Function for Case-Base Maintenance","https://api.semanticscholar.org/CorpusID:3250392"
"1778828342-188","https://archive.ics.uci.edu/dataset/53/iris","","Demystifying Information-Theoretic Clustering","By Greg Steeg, Aram Galstyan, Fei Sha, Simon DeDeo. 2013","Published in ArXiv.","Demystifying Information-Theoretic Clustering","https://api.semanticscholar.org/CorpusID:6971397"
"1778828342-189","https://archive.ics.uci.edu/dataset/53/iris","","Clustering as an Example of Optimizing Arbitrarily Chosen Objective Functions","By Marcin Budka. 2013","Published in Advanced Methods for Computational Collective Intelligence.","Clustering as an Example of Optimizing Arbitrarily Chosen Objective Functions","https://api.semanticscholar.org/CorpusID:10974445"
"1778828342-190","https://archive.ics.uci.edu/dataset/53/iris","","LVQ-SMOTE – Learning Vector Quantization based Synthetic Minority Over–sampling Technique for biomedical data","By Munehiro Nakamura, Yusuke Kajiwara, Atsushi Otsuka, Haruhiko Kimura. 2013","Published in BioData mining.","LVQ-SMOTE – Learning Vector Quantization based Synthetic Minority Over–sampling Technique for biomedical data","https://api.semanticscholar.org/CorpusID:5255707"
"1778828342-191","https://archive.ics.uci.edu/dataset/53/iris","","Fast Linear Adaptive Skipping Training Algorithm for Training Artificial Neural Network","By R. Devi, S. Kuppuswami, R. Suganthe. 2013","Published in Mathematical Problems in Engineering.","Fast Linear Adaptive Skipping Training Algorithm for Training Artificial Neural Network","https://api.semanticscholar.org/CorpusID:62584654"
"1778828342-192","https://archive.ics.uci.edu/dataset/53/iris","","High Level Pattern Classification via Tourist Walks in Networks","By Thiago Silva, Liang Zhao. 2013","Published in ArXiv.","High Level Pattern Classification via Tourist Walks in Networks","https://api.semanticscholar.org/CorpusID:3521852"
"1778828342-193","https://archive.ics.uci.edu/dataset/53/iris","","A Review of Privacy Essentials for Confidential Mobile Data Transactions","By Kato Mivule, Claude Turner. 2013","Published in ArXiv.","A Review of Privacy Essentials for Confidential Mobile Data Transactions","https://api.semanticscholar.org/CorpusID:7564503"
"1778828342-194","https://archive.ics.uci.edu/dataset/53/iris","","Robust Hierarchical Clustering","By Maria-Florina Balcan, Yingyu Liang, Pramod Gupta. 2013","Published in ArXiv.","Robust Hierarchical Clustering","https://api.semanticscholar.org/CorpusID:1268790"
"1778828342-195","https://archive.ics.uci.edu/dataset/53/iris","","Pinch Ratio Clustering from a Topologically Intrinsic Lexicographic Ordering","By Douglas Heisterkamp, Jesse Johnson. 2013","Published in SDM.","Pinch Ratio Clustering from a Topologically Intrinsic Lexicographic Ordering","https://api.semanticscholar.org/CorpusID:235736"
"1778828342-196","https://archive.ics.uci.edu/dataset/53/iris","","Clustering-based anomaly detection in multi-view data","By Alejandro Marcos Alvarez, Makoto Yamada, Akisato Kimura, Tomoharu Iwata. 2013","Published in CIKM.","Clustering-based anomaly detection in multi-view data","https://api.semanticscholar.org/CorpusID:16525646"
"1778828342-197","https://archive.ics.uci.edu/dataset/53/iris","","Missing Value Imputation With Unsupervised Backpropagation","By Michael Gashler, Michael Smith, Richard Morris, Tony Martinez. 2013","Published in ArXiv.","Missing Value Imputation With Unsupervised Backpropagation","https://api.semanticscholar.org/CorpusID:9706389"
"1778828342-198","https://archive.ics.uci.edu/dataset/53/iris","","Comparative study of matrix refinement approaches for ensemble clustering","By Natthakan Iam-On, Tossapon Boongoen. 2013","Published in Machine Learning.","Comparative study of matrix refinement approaches for ensemble clustering","https://api.semanticscholar.org/CorpusID:15373514"
"1778828342-199","https://archive.ics.uci.edu/dataset/53/iris","","Flexible and robust co-regularized multi-domain graph clustering","By Wei Cheng, Xiang Zhang, Zhishan Guo, Yubao Wu, Patrick Sullivan, Wei Wang. 2013","Published in KDD '13.","Flexible and robust co-regularized multi-domain graph clustering","https://api.semanticscholar.org/CorpusID:13456369"
"1778828342-200","https://archive.ics.uci.edu/dataset/53/iris","","A Support Vector Classifier Based on Vague Similarity Measure","By Yong Zhang, Jing Cai. 2013","Published in Mathematical Problems in Engineering.","A Support Vector Classifier Based on Vague Similarity Measure","https://api.semanticscholar.org/CorpusID:56380686"
"1778828342-201","https://archive.ics.uci.edu/dataset/53/iris","","Imprecise Imputation as a Tool for Solving Classification Problems with Mean Values of Unobserved Features","By Lev Utkin, Yulia Zhuk. 2013","Published in Adv. Artificial Intellegence.","Imprecise Imputation as a Tool for Solving Classification Problems with Mean Values of Unobserved Features","https://api.semanticscholar.org/CorpusID:34882641"
"1778828342-202","https://archive.ics.uci.edu/dataset/53/iris","","Enhanced Dark Block Extraction Method Performed Automatically to Determine the Number of Clusters in Unlabeled Data Sets","By Puniethaa Prabhu, K. Duraiswamy. 2013","Published in International Journal of Computers Communications & Control.","Enhanced Dark Block Extraction Method Performed Automatically to Determine the Number of Clusters in Unlabeled Data Sets","https://api.semanticscholar.org/CorpusID:32602866"
"1778828342-203","https://archive.ics.uci.edu/dataset/53/iris","","Double indices-induced FCM clustering and its integration with fuzzy subspace clustering","By Jun Wang, Fu-lai Chung, Shitong Wang, Zhaohong Deng. 2013","Published in Pattern Analysis and Applications.","Double indices-induced FCM clustering and its integration with fuzzy subspace clustering","https://api.semanticscholar.org/CorpusID:8901647"
"1778828342-204","https://archive.ics.uci.edu/dataset/53/iris","","Active Rare Class Discovery and Classification Using Dirichlet Processes","By Tom Haines, Tao Xiang. 2013","Published in International Journal of Computer Vision.","Active Rare Class Discovery and Classification Using Dirichlet Processes","https://api.semanticscholar.org/CorpusID:3631730"
"1778828342-205","https://archive.ics.uci.edu/dataset/53/iris","","Unsupervised Approach Data Analysis Based on Fuzzy Possibilistic Clustering: Application to Medical Image MRI","By Nour-Eddine El Harchaoui, Mounir Ait Kerroum, Ahmed Hammouch, Mohamed Ouadou, Driss Aboutajdine. 2013","Published in Computational intelligence and neuroscience.","Unsupervised Approach Data Analysis Based on Fuzzy Possibilistic Clustering: Application to Medical Image MRI","https://api.semanticscholar.org/CorpusID:6573258"
"1778828342-206","https://archive.ics.uci.edu/dataset/53/iris","","Dimension Reduction and Clustering of High Dimensional Data using Auto-Associative Neural Networks","By Zalhan Zin, Rubiyah Yusof, Ehsan Mesbahi. 2013","Published in International Journal of Computer Applications.","Dimension Reduction and Clustering of High Dimensional Data using Auto-Associative Neural Networks","https://api.semanticscholar.org/CorpusID:14295149"
"1778828342-207","https://archive.ics.uci.edu/dataset/53/iris","","Hybrid Ant-based Clustering Algorithm with Cluster Analysis Techniques","By Wafaa Omar, Amr Badr, Abdel Hegazy. 2013","Published in JCS.","Hybrid Ant-based Clustering Algorithm with Cluster Analysis Techniques","https://api.semanticscholar.org/CorpusID:31938007"
"1778828342-208","https://archive.ics.uci.edu/dataset/53/iris","","A Spectral Clustering Approach Based on Newton’s Equations of Motion","By Konstantinos Blekas, Isaac Lagaris. 2013","Published in Int. J. Intell. Syst..","A Spectral Clustering Approach Based on Newton’s Equations of Motion","https://api.semanticscholar.org/CorpusID:11677731"
"1778828342-209","https://archive.ics.uci.edu/dataset/53/iris","","Differentially Private Projected Histograms: Construction and Use for Prediction","By Staal Vinterbo. 2012","Published in ECML/PKDD.","Differentially Private Projected Histograms: Construction and Use for Prediction","https://api.semanticscholar.org/CorpusID:18099322"
