web_scraper_order,web_scraper_start_url,pagination,data,data2,data3,item_page_title,item_page_link
"1778828342-210","https://archive.ics.uci.edu/dataset/53/iris","","A FUZZY INCREMENTAL CLUSTERING APPROACH TO HYBRID DATA DISCOVERY","By Radu Găceanu, Horia Pop. 2012","Published in Acta Electrotechnica et Informatica.","A FUZZY INCREMENTAL CLUSTERING APPROACH TO HYBRID DATA DISCOVERY","https://api.semanticscholar.org/CorpusID:110614785"
"1778828342-211","https://archive.ics.uci.edu/dataset/53/iris","","Learning feature-projection based classifiers","By Aynur Dayanik. 2012","Published in Expert Syst. Appl..","Learning feature-projection based classifiers","https://api.semanticscholar.org/CorpusID:28198449"
"1778828342-212","https://archive.ics.uci.edu/dataset/53/iris","","On Constrained Spectral Clustering and Its Applications","By Xiang Wang, Buyue Qian, Ian Davidson. 2012","Published in ArXiv.","On Constrained Spectral Clustering and Its Applications","https://api.semanticscholar.org/CorpusID:316771"
"1778828342-213","https://archive.ics.uci.edu/dataset/53/iris","","Active spectral clustering via iterative uncertainty reduction","By Fabian Wauthier, Nebojsa Jojic, Michael Jordan. 2012","Published in KDD.","Active spectral clustering via iterative uncertainty reduction","https://api.semanticscholar.org/CorpusID:8963513"
"1778828342-214","https://archive.ics.uci.edu/dataset/53/iris","","Fuzzy One-Class Classification Model Using Contamination Neighborhoods","By Lev Utkin. 2012","Published in Adv. Fuzzy Systems.","Fuzzy One-Class Classification Model Using Contamination Neighborhoods","https://api.semanticscholar.org/CorpusID:31144859"
"1778828342-215","https://archive.ics.uci.edu/dataset/53/iris","","A FUZZY FAST CLASSIFICATION FOR SHARE MARKET DATABASE WITH LOWER AND UPPER BOUNDS","By Srinivasan Vaiyapuri, Rajenderan Govind, Vandar Jaganathan. 2012","Published in American Journal of Applied Sciences.","A FUZZY FAST CLASSIFICATION FOR SHARE MARKET DATABASE WITH LOWER AND UPPER BOUNDS","https://api.semanticscholar.org/CorpusID:18608117"
"1778828342-216","https://archive.ics.uci.edu/dataset/53/iris","","Ensemble Clustering for Biological Datasets","By Harun Pirim, Sadi Seker. 2012","Published in Bioinformatics.","Ensemble Clustering for Biological Datasets","https://api.semanticscholar.org/CorpusID:53417963"
"1778828342-217","https://archive.ics.uci.edu/dataset/53/iris","","Comparing error minimized extreme learning machines and support vector sequential feed-forward neural networks","By Enrique Romero, René Alquézar. 2012","Published in Neural networks : the official journal of the International Neural Network Society.","Comparing error minimized extreme learning machines and support vector sequential feed-forward neural networks","https://api.semanticscholar.org/CorpusID:2516904"
"1778828342-218","https://archive.ics.uci.edu/dataset/53/iris","","Bayesian Model Averaging Using the k-best Bayesian Network Structures","By Jin Tian, Ru He, Lavanya Ram. 2012","Published in ArXiv.","Bayesian Model Averaging Using the k-best Bayesian Network Structures","https://api.semanticscholar.org/CorpusID:1562532"
"1778828342-219","https://archive.ics.uci.edu/dataset/53/iris","","Training a Feed-forward Neural Network with Artificial Bee Colony Based Backpropagation Method","By Sudarshan Nandy, Partha Sarkar, Achintya Das. 2012","Published in International Journal of Computer Science&Information Technology (IJCSIT) Vol 4, No 4, 2012, 33-46.","Training a Feed-forward Neural Network with Artificial Bee Colony Based Backpropagation Method","https://api.semanticscholar.org/CorpusID:6886002"
"1778828342-220","https://archive.ics.uci.edu/dataset/53/iris","","Cultural Algorithm Toolkit for Multi-objective Rule Mining","By Sujatha Srinivasan, Sivakumar Ramakrishnan. 2012","Published in International Journal on Computational Sciences&Applications (IJCSA) Vo2, No.4, 2012, 9-23.","Cultural Algorithm Toolkit for Multi-objective Rule Mining","https://api.semanticscholar.org/CorpusID:7712586"
"1778828342-221","https://archive.ics.uci.edu/dataset/53/iris","","“I can tell you what it’s not”: active learning from counterexamples","By Nicolas Cebron, Fabian Richter, Rainer Lienhart. 2012","Published in Progress in Artificial Intelligence.","“I can tell you what it’s not”: active learning from counterexamples","https://api.semanticscholar.org/CorpusID:14686269"
"1778828342-222","https://archive.ics.uci.edu/dataset/53/iris","","Firefly Meta-Heuristic Algorithm for Training the Radial Basis Function Network for Data Classification and Disease Diagnosis","By Ming-Huwi Horng, Yun-Xiang Lee, Ming-Chi Lee, Ren-Jean Liou. 2012","Published in Theory and New Applications of Swarm Intelligence.","Firefly Meta-Heuristic Algorithm for Training the Radial Basis Function Network for Data Classification and Disease Diagnosis","https://api.semanticscholar.org/CorpusID:51803550"
"1778828342-223","https://archive.ics.uci.edu/dataset/53/iris","","Fuzzy Model Identification : A Firefly Optimization Approach","By Shakti Kumar, Parvinder Kaur, Amar Singh. 2012","Published in International Journal of Computer Applications.","Fuzzy Model Identification : A Firefly Optimization Approach","https://api.semanticscholar.org/CorpusID:8591787"
"1778828342-224","https://archive.ics.uci.edu/dataset/53/iris","","Datasets as Interacting Particle Systems: a Framework for Clustering","By Giuliano Armano, Marco Javarone. 2012","Published in","Datasets as Interacting Particle Systems: a Framework for Clustering","https://api.semanticscholar.org/CorpusID:17281244"
"1778828342-225","https://archive.ics.uci.edu/dataset/53/iris","","An Efficient Hybrid Particle Swarm Optimization for Data Clustering","By M Seetha. 2012","Published in International Journal of Data Mining & Knowledge Management Process.","An Efficient Hybrid Particle Swarm Optimization for Data Clustering","https://api.semanticscholar.org/CorpusID:10687452"
"1778828342-226","https://archive.ics.uci.edu/dataset/53/iris","","Cultural Algorithm Toolkit for Interactive Knowledge Discovery","By Sujatha Srinivasan. 2012","Published in International Journal of Data Mining & Knowledge Management Process.","Cultural Algorithm Toolkit for Interactive Knowledge Discovery","https://api.semanticscholar.org/CorpusID:412659"
"1778828342-227","https://archive.ics.uci.edu/dataset/53/iris","","Fast nonparametric classification based on data depth","By Tatjana Lange, Karl Mosler, Pavlo Mozharovskyi. 2012","Published in Statistical Papers 55 (2014), 49-69.","Fast nonparametric classification based on data depth","https://api.semanticscholar.org/CorpusID:4784508"
"1778828342-228","https://archive.ics.uci.edu/dataset/53/iris","","A HYBRID MODEL FOR BUSINESS FAILURE PREDICTION { UTILIZATION OF PARTICLE SWARM OPTIMIZATION AND SUPPORT VECTOR MACHINES","By Mu-Yen Chen. 2011","Published in Neural Network World.","A HYBRID MODEL FOR BUSINESS FAILURE PREDICTION { UTILIZATION OF PARTICLE SWARM OPTIMIZATION AND SUPPORT VECTOR MACHINES","https://api.semanticscholar.org/CorpusID:5359118"
"1778828342-229","https://archive.ics.uci.edu/dataset/53/iris","","Spatially-Aware Comparison and Consensus for Clusterings","By Parasaran Raman, Jeff Phillips, Suresh Venkatasubramanian. 2011","Published in ArXiv.","Spatially-Aware Comparison and Consensus for Clusterings","https://api.semanticscholar.org/CorpusID:14113875"
"1778828342-230","https://archive.ics.uci.edu/dataset/53/iris","","A Clustering Approach Using Weighted Similarity Majority Margins","By Raymond Bisdorff, Patrick Meyer, Alexandru-Liviu Olteanu. 2011","Published in ADMA.","A Clustering Approach Using Weighted Similarity Majority Margins","https://api.semanticscholar.org/CorpusID:17836319"
"1778828342-231","https://archive.ics.uci.edu/dataset/53/iris","","Data management support via spectrum perturbation-based subspace classification in collaborative environments","By Chao Chen, Mei-Ling Shyu, Shu-Ching Chen. 2011","Published in 7th International Conference on Collaborative Computing: Networking, Applications and Worksharing (CollaborateCom).","Data management support via spectrum perturbation-based subspace classification in collaborative environments","https://api.semanticscholar.org/CorpusID:8244525"
"1778828342-232","https://archive.ics.uci.edu/dataset/53/iris","","GPUSVM: a comprehensive CUDA based support vector machine package","By Qi Li, Raied Salman, Erik Test, Robert Strack, Vojislav Kecman. 2011","Published in Central European Journal of Computer Science.","GPUSVM: a comprehensive CUDA based support vector machine package","https://api.semanticscholar.org/CorpusID:15109625"
"1778828342-233","https://archive.ics.uci.edu/dataset/53/iris","","Performance of an Ensemble Clustering Algorithm on Biological Data Sets","By Harun Pirim, Dilip Gautam, Tanmay Bhowmik, Andy Perkins, Burak Eksioglu, Ahmet Alkan. 2011","Published in Mathematical and Computational Applications.","Performance of an Ensemble Clustering Algorithm on Biological Data Sets","https://api.semanticscholar.org/CorpusID:12955802"
"1778828342-234","https://archive.ics.uci.edu/dataset/53/iris","","Fast Projection Pursuit Based on Quality of Projected Clusters","By Marek Grochowski, Wlodzislaw Duch. 2011","Published in ICANNGA.","Fast Projection Pursuit Based on Quality of Projected Clusters","https://api.semanticscholar.org/CorpusID:6178270"
"1778828342-235","https://archive.ics.uci.edu/dataset/53/iris","","Generating a Diverse Set of High-Quality Clusterings","By Jeff Phillips, Parasaran Raman, Suresh Venkatasubramanian. 2011","Published in ArXiv.","Generating a Diverse Set of High-Quality Clusterings","https://api.semanticscholar.org/CorpusID:1310752"
"1778828342-236","https://archive.ics.uci.edu/dataset/53/iris","","Receptive field optimisation and supervision of a fuzzy spiking neural network.","By Cornelius Glackin, Liam Maguire, Liam McDaid, Heather Sayers. 2011","Published in Neural networks : the official journal of the International Neural Network Society.","Receptive field optimisation and supervision of a fuzzy spiking neural network.","https://api.semanticscholar.org/CorpusID:14271332"
"1778828342-237","https://archive.ics.uci.edu/dataset/53/iris","","Local matrix adaptation in topographic neural maps","By Banchar Arnonkijpanich, Alexander Hasenfuss, Barbara Hammer. 2011","Published in Neurocomputing.","Local matrix adaptation in topographic neural maps","https://api.semanticscholar.org/CorpusID:18007180"
"1778828342-238","https://archive.ics.uci.edu/dataset/53/iris","","Incorporating Dynamic Uncertainties into a Fuzzy Classifier","By Jens Hülsmann, Andreas Buschermöhle, Werner Brockmann. 2011","Published in EUSFLAT Conf..","Incorporating Dynamic Uncertainties into a Fuzzy Classifier","https://api.semanticscholar.org/CorpusID:17687435"
"1778828342-239","https://archive.ics.uci.edu/dataset/53/iris","","Semi-Supervised Classification Using Tree-Based Self-Organizing Maps","By César Astudillo, B. Oommen. 2011","Published in Australasian Conference on Artificial Intelligence.","Semi-Supervised Classification Using Tree-Based Self-Organizing Maps","https://api.semanticscholar.org/CorpusID:36669826"
"1778828342-240","https://archive.ics.uci.edu/dataset/53/iris","","M-Estimator induced Fuzzy Clustering Algorithms","By Roland Winkler, Frank Klawonn, Rudolf Kruse. 2011","Published in EUSFLAT Conf..","M-Estimator induced Fuzzy Clustering Algorithms","https://api.semanticscholar.org/CorpusID:15729073"
"1778828342-241","https://archive.ics.uci.edu/dataset/53/iris","","Hierarchical information clustering by means of topologically embedded graphs","By Won-Min Song, T. Matteo, Tomaso Aste. 2011","Published in PLoS ONE 7 (2012) e31929.","Hierarchical information clustering by means of topologically embedded graphs","https://api.semanticscholar.org/CorpusID:3855960"
"1778828342-242","https://archive.ics.uci.edu/dataset/53/iris","","Analysis of Feature Weighting Methods Based on Feature Ranking Methods for Classification","By Norbert Jankowski, Krzysztof Usowicz. 2011","Published in ICONIP.","Analysis of Feature Weighting Methods Based on Feature Ranking Methods for Classification","https://api.semanticscholar.org/CorpusID:40858969"
"1778828342-243","https://archive.ics.uci.edu/dataset/53/iris","","AVLR-EBP: A Variable Step Size Approach to Speed-up the Convergence of Error Back-Propagation Algorithm","By Arman Didandeh, Nima Mirbakhsh, Ali Amiri, Mahmood Fathy. 2011","Published in Neural Processing Letters.","AVLR-EBP: A Variable Step Size Approach to Speed-up the Convergence of Error Back-Propagation Algorithm","https://api.semanticscholar.org/CorpusID:31252053"
"1778828342-244","https://archive.ics.uci.edu/dataset/53/iris","","The effect of low number of points in clustering validation via the negentropy increment","By Luis Lago-Fernández, Manuel Sánchez-Montañés, Fernando Corbacho. 2011","Published in Neurocomputing.","The effect of low number of points in clustering validation via the negentropy increment","https://api.semanticscholar.org/CorpusID:26529903"
"1778828342-245","https://archive.ics.uci.edu/dataset/53/iris","","A Novel Approach for Clustering based on Pattern Analysis","By Prachi Joshi, Parag Kulkarni. 2011","Published in International Journal of Computer Applications.","A Novel Approach for Clustering based on Pattern Analysis","https://api.semanticscholar.org/CorpusID:12669102"
"1778828342-246","https://archive.ics.uci.edu/dataset/53/iris","","A NEW DAMPING STRATEGY OF LEVENBERG-MARQUARDT ALGORITHM FOR MULTILAYER PERCEPTRONS","By Young-tae Kwak, Ji-won Hwang, Cheol-Jung Yoo. 2011","Published in Neural Network World.","A NEW DAMPING STRATEGY OF LEVENBERG-MARQUARDT ALGORITHM FOR MULTILAYER PERCEPTRONS","https://api.semanticscholar.org/CorpusID:17745963"
"1778828342-247","https://archive.ics.uci.edu/dataset/53/iris","","Improved Fuzzy Art Method for Initializing K-means","By Sevinç Ilhan, Nevcihan Duru, Esref Adali. 2010","Published in Int. J. Comput. Intell. Syst..","Improved Fuzzy Art Method for Initializing K-means","https://api.semanticscholar.org/CorpusID:15463537"
"1778828342-248","https://archive.ics.uci.edu/dataset/53/iris","","Fuzzy Classifier Design using Modified Genetic Algorithm","By P. Kumar, D. Devaraj. 2010","Published in Int. J. Comput. Intell. Syst..","Fuzzy Classifier Design using Modified Genetic Algorithm","https://api.semanticscholar.org/CorpusID:4959166"
"1778828342-249","https://archive.ics.uci.edu/dataset/53/iris","","Best Clustering Configuration Metrics: Towards Multiagent Based Clustering","By Santhana Chaimontree, Katie Atkinson, Frans Coenen. 2010","Published in ADMA.","Best Clustering Configuration Metrics: Towards Multiagent Based Clustering","https://api.semanticscholar.org/CorpusID:3735845"
"1778828342-250","https://archive.ics.uci.edu/dataset/53/iris","","clues : An R Package for Nonparametric Clustering Based on Local Shrinking","By Fang Chang, Weiliang Qiu, Ruben Zamar, Ross Lazarus, Xiaogang Wang. 2010","Published in Journal of Statistical Software.","clues : An R Package for Nonparametric Clustering Based on Local Shrinking","https://api.semanticscholar.org/CorpusID:13241130"
"1778828342-251","https://archive.ics.uci.edu/dataset/53/iris","","Learning from partially supervised data using mixture models and belief functions","By Etienne Côme, Latifa Oukhellou, Thierry Denoeux, Patrice Aknin. 2010","Published in Pattern Recognition.","Learning from partially supervised data using mixture models and belief functions","https://api.semanticscholar.org/CorpusID:7748880"
"1778828342-252","https://archive.ics.uci.edu/dataset/53/iris","","RULES3-EXT Improvements on RULES-3 Induction Algorithm","By Hassan Mathkour. 2010","Published in Mathematical and Computational Applications.","RULES3-EXT Improvements on RULES-3 Induction Algorithm","https://api.semanticscholar.org/CorpusID:17440905"
"1778828342-253","https://archive.ics.uci.edu/dataset/53/iris","","A probabilistic tri-class Support Vector Machine","By Juan Ramírez, Luis Abril, Francisco Morente, Cecilio Angulo. 2010","Published in Journal of Pattern Recognition Research.","A probabilistic tri-class Support Vector Machine","https://api.semanticscholar.org/CorpusID:33612399"
"1778828342-254","https://archive.ics.uci.edu/dataset/53/iris","","Artificial Neural Networks, Symmetries and Differential Evolution","By Onay Urfalioglu, Orhan Arikan. 2010","Published in ArXiv.","Artificial Neural Networks, Symmetries and Differential Evolution","https://api.semanticscholar.org/CorpusID:18439147"
"1778828342-255","https://archive.ics.uci.edu/dataset/53/iris","","Analysis of the consistency of a mixed integer programming-based multi-category constrained discriminant model","By J. Brooks, Eva Lee. 2010","Published in Annals OR.","Analysis of the consistency of a mixed integer programming-based multi-category constrained discriminant model","https://api.semanticscholar.org/CorpusID:16595829"
"1778828342-256","https://archive.ics.uci.edu/dataset/53/iris","","Open issues in genetic programming","By Michael O’Neill, Leonardo Vanneschi, Steven Gustafson, Wolfgang Banzhaf. 2010","Published in Genetic Programming and Evolvable Machines.","Open issues in genetic programming","https://api.semanticscholar.org/CorpusID:12919412"
"1778828342-257","https://archive.ics.uci.edu/dataset/53/iris","","Flexible constrained spectral clustering","By Xiang Wang, Ian Davidson. 2010","Published in KDD '10.","Flexible constrained spectral clustering","https://api.semanticscholar.org/CorpusID:2948946"
"1778828342-258","https://archive.ics.uci.edu/dataset/53/iris","","Triangular Visualization","By Tomasz Maszczyk, Wlodzislaw Duch. 2010","Published in ICAISC.","Triangular Visualization","https://api.semanticscholar.org/CorpusID:11495899"
"1778828342-259","https://archive.ics.uci.edu/dataset/53/iris","","Rule Learning With Negation: Issues Regarding Effectiveness","By Stephanie Chua, Frans Coenen, Grant Malcolm. 2010","Published in Intelligent Information Processing.","Rule Learning With Negation: Issues Regarding Effectiveness","https://api.semanticscholar.org/CorpusID:2011934"
"1778828342-260","https://archive.ics.uci.edu/dataset/53/iris","","Supervised learning of local projection kernels","By Mehmet Gönen, Ethem Alpaydin. 2009","Published in NEUROCOMPUTING.","Supervised learning of local projection kernels","https://api.semanticscholar.org/CorpusID:7841095"
"1778828342-261","https://archive.ics.uci.edu/dataset/53/iris","","Metric in Feature Space","By C. Murthy, Sourav Pradhan. 2009","Published in PReMI.","Metric in Feature Space","https://api.semanticscholar.org/CorpusID:8537147"
"1778828342-262","https://archive.ics.uci.edu/dataset/53/iris","","On the quest for optimal rule learning heuristics","By Frederik Janssen, Johannes Fürnkranz. 2009","Published in Machine Learning.","On the quest for optimal rule learning heuristics","https://api.semanticscholar.org/CorpusID:386503"
"1778828342-263","https://archive.ics.uci.edu/dataset/53/iris","","A scalable framework for cluster ensembles","By Prodip Hore, Lawrence Hall, Dmitry Goldgof. 2009","Published in PATTERN RECOGNITION.","A scalable framework for cluster ensembles","https://api.semanticscholar.org/CorpusID:7065229"
"1778828342-264","https://archive.ics.uci.edu/dataset/53/iris","","A new generative feature set based on entropy distance for discriminative classification","By Alessandro Perina, Marco Cristani, Umberto Castellani, Vittorio Murino. 2009","Published in ICIAP.","A new generative feature set based on entropy distance for discriminative classification","https://api.semanticscholar.org/CorpusID:14784201"
"1778828342-265","https://archive.ics.uci.edu/dataset/53/iris","","An Instantiation of Hierarchical Distance-based Conceptual Clustering for Propositional Learning","By Ana Funes, César Ferri, José Hernández-Orallo, M. Ramírez-Quintana. 2009","Published in PAKDD.","An Instantiation of Hierarchical Distance-based Conceptual Clustering for Propositional Learning","https://api.semanticscholar.org/CorpusID:7612052"
"1778828342-266","https://archive.ics.uci.edu/dataset/53/iris","","Neural Network Ensembles from Training Set Expansions","By Debrup Chakraborty. 2009","Published in CIARP.","Neural Network Ensembles from Training Set Expansions","https://api.semanticscholar.org/CorpusID:8338768"
"1778828342-267","https://archive.ics.uci.edu/dataset/53/iris","","A New Discriminant Principal Component Analysis Method with Partial Supervision","By Dan Sun, Daoqiang Zhang. 2009","Published in Neural Processing Letters.","A New Discriminant Principal Component Analysis Method with Partial Supervision","https://api.semanticscholar.org/CorpusID:25868589"
"1778828342-268","https://archive.ics.uci.edu/dataset/53/iris","","Accelerating Fuzzy Clustering","By Christian Borgelt. 2009","Published in Inf. Sci..","Accelerating Fuzzy Clustering","https://api.semanticscholar.org/CorpusID:18473442"
"1778828342-269","https://archive.ics.uci.edu/dataset/53/iris","","Multi-Objective Differential Evolution for Automatic Clustering with Application to Micro-Array Data Analysis","By Kaushik Suresh, Debarati Kundu, Sayan Ghosh, Swagatam Das, Ajith Abraham, Sang Han. 2009","Published in Sensors.","Multi-Objective Differential Evolution for Automatic Clustering with Application to Micro-Array Data Analysis","https://api.semanticscholar.org/CorpusID:15567259"
"1778828342-270","https://archive.ics.uci.edu/dataset/53/iris","","Information Theoretic Novelty Detection","By Maurizio Filippone, Guido Sanguinetti. 2009","Published in Pattern Recognition.","Information Theoretic Novelty Detection","https://api.semanticscholar.org/CorpusID:8113110"
"1778828342-271","https://archive.ics.uci.edu/dataset/53/iris","","GF-Miner: a Genetic Fuzzy Classifier for Numerical Data","By Vicky Tsikolidaki, Nikos Pelekis, Yannis Theodoridis. 2009","Published in AIAI.","GF-Miner: a Genetic Fuzzy Classifier for Numerical Data","https://api.semanticscholar.org/CorpusID:8031425"
"1778828342-272","https://archive.ics.uci.edu/dataset/53/iris","","Ensemble Methods for Boosting Visualization Models","By Bruno Baruque, Emilio Corchado, Aitor Mata, Juan Corchado. 2009","Published in IWANN.","Ensemble Methods for Boosting Visualization Models","https://api.semanticscholar.org/CorpusID:3236637"
"1778828342-273","https://archive.ics.uci.edu/dataset/53/iris","","HDD: a hypercube division-based algorithm for discretisation","By Ping Yang, JiSheng Li, YongXuan Huang. 2009","Published in Int. J. Systems Science.","HDD: a hypercube division-based algorithm for discretisation","https://api.semanticscholar.org/CorpusID:611857"
"1778828342-274","https://archive.ics.uci.edu/dataset/53/iris","","Automatic system testing of programs without test oracles","By Christian Murphy, Kuang Shen, Gail Kaiser. 2009","Published in ISSTA.","Automatic system testing of programs without test oracles","https://api.semanticscholar.org/CorpusID:7813863"
"1778828342-275","https://archive.ics.uci.edu/dataset/53/iris","","Automatic Clustering Using a Synergy of Genetic Algorithm and Multi-objective Differential Evolution","By Debarati Kundu, Kaushik Suresh, Sayan Ghosh, Swagatam Das, Ajith Abraham, Youakim Badr. 2009","Published in HAIS.","Automatic Clustering Using a Synergy of Genetic Algorithm and Multi-objective Differential Evolution","https://api.semanticscholar.org/CorpusID:3333232"
"1778828342-276","https://archive.ics.uci.edu/dataset/53/iris","","A Study on the Behaviour of the Algorithm for Finding Relevant Attributes and Membership Functions","By Madara Gasparoviča, Ludmila Aleksejeva. 2009","Published in J. Riga Technical University.","A Study on the Behaviour of the Algorithm for Finding Relevant Attributes and Membership Functions","https://api.semanticscholar.org/CorpusID:9950616"
"1778828342-277","https://archive.ics.uci.edu/dataset/53/iris","","Learning similarity functions from qualitative feedback","By Weiwei Cheng, Eyke Hüllermeier. 2008","Published in Advances in Case-Based Reasoning.","Learning similarity functions from qualitative feedback","https://api.semanticscholar.org/CorpusID:4761009"
"1778828342-278","https://archive.ics.uci.edu/dataset/53/iris","","A Novel Clustering Algorithm Based on a Modified Model of Random Walk","By Qiang Li, Yan He, Jing-ping Jiang. 2008","Published in ArXiv.","A Novel Clustering Algorithm Based on a Modified Model of Random Walk","https://api.semanticscholar.org/CorpusID:18685529"
"1778828342-279","https://archive.ics.uci.edu/dataset/53/iris","","A Novel Clustering Algorithm Based Upon Games on Evolving Network","By Qiang Li, Zhuo Chen, Yan He, Jing-ping Jiang. 2008","Published in Expert Systems with Applications, 2010.","A Novel Clustering Algorithm Based Upon Games on Evolving Network","https://api.semanticscholar.org/CorpusID:9023751"
"1778828342-280","https://archive.ics.uci.edu/dataset/53/iris","","Self-Organizing Map with False Neighbor Degree between Neurons for Effective Self-Organization","By Haruna Matsushita, Yoshifumi Nishio. 2008","Published in IEICE Transactions.","Self-Organizing Map with False Neighbor Degree between Neurons for Effective Self-Organization","https://api.semanticscholar.org/CorpusID:16478641"
"1778828342-281","https://archive.ics.uci.edu/dataset/53/iris","","Dempster-Shafer for Anomaly Detection","By Qi Chen, Uwe Aickelin. 2008","Published in Proceedings of the International Conference on Data Mining (DMIN 2006), pp 232-238, Las Vegas, USA 2006.","Dempster-Shafer for Anomaly Detection","https://api.semanticscholar.org/CorpusID:5302654"
