web_scraper_order,web_scraper_start_url,pagination,data,data2,data3,item_page_title,item_page_link
"1778828826-1","https://archive.ics.uci.edu/dataset/17/breast+cancer+wisconsin+diagnostic","","Machine learning in medicine: a practical introduction","By Jenni Sidey-Gibbons, Chris Sidey-Gibbons. 2019","Published in BMC medical research methodology.","Machine learning in medicine: a practical introduction","https://api.semanticscholar.org/CorpusID:84183143"
"1778828826-2","https://archive.ics.uci.edu/dataset/17/breast+cancer+wisconsin+diagnostic","","Data Augmentation Using GANs","By Fabio Tanaka, Claus Aranha. 2019","Published in ArXiv.","Data Augmentation Using GANs","https://api.semanticscholar.org/CorpusID:126180363"
"1778828826-3","https://archive.ics.uci.edu/dataset/17/breast+cancer+wisconsin+diagnostic","","Empirical study towards understanding line search approximations for training neural networks","By Younghwan Chae, Daniel Wilke. 2019","Published in","Empirical study towards understanding line search approximations for training neural networks","https://api.semanticscholar.org/CorpusID:202578064"
"1778828826-4","https://archive.ics.uci.edu/dataset/17/breast+cancer+wisconsin+diagnostic","","Interpretable Counterfactual Explanations Guided by Prototypes","By Arnaud Looveren, Janis Klaise. 2019","Published in ArXiv.","Interpretable Counterfactual Explanations Guided by Prototypes","https://api.semanticscholar.org/CorpusID:195820639"
"1778828826-5","https://archive.ics.uci.edu/dataset/17/breast+cancer+wisconsin+diagnostic","","PIDT: A Novel Decision Tree Algorithm Based on Parameterised Impurities and Statistical Pruning Approaches","By Daniel Stamate, Wajdi Alghamdi, Daniel Stahl, Doina Logofatu, Alexander Zamyatin. 2018","Published in AIAI.","PIDT: A Novel Decision Tree Algorithm Based on Parameterised Impurities and Statistical Pruning Approaches","https://api.semanticscholar.org/CorpusID:46896638"
"1778828826-6","https://archive.ics.uci.edu/dataset/17/breast+cancer+wisconsin+diagnostic","","Mixtures of Factor Analyzers with Fundamental Skew Symmetric Distributions","By Sharon Lee, Tsung-I Lin, Geoffrey McLachlan. 2018","Published in","Mixtures of Factor Analyzers with Fundamental Skew Symmetric Distributions","https://api.semanticscholar.org/CorpusID:88522941"
"1778828826-7","https://archive.ics.uci.edu/dataset/17/breast+cancer+wisconsin+diagnostic","","Machine Learning Approaches for Cancer Detection","By Ayush Sharma, Sudhanshu Kulshrestha, Sibi Daniel. 2018","Published in International Journal of Engineering and Manufacturing.","Machine Learning Approaches for Cancer Detection","https://api.semanticscholar.org/CorpusID:55082179"
"1778828826-8","https://archive.ics.uci.edu/dataset/17/breast+cancer+wisconsin+diagnostic","","Data Clustering: An Approach for Evaluating the Adequate Number of Groups in Partitioned Techniques","By Guillermo Castillo, Yaimara González, Alejandro Mena. 2017","Published in Journal of Computer Science and Information Technology.","Data Clustering: An Approach for Evaluating the Adequate Number of Groups in Partitioned Techniques","https://api.semanticscholar.org/CorpusID:53618231"
"1778828826-9","https://archive.ics.uci.edu/dataset/17/breast+cancer+wisconsin+diagnostic","","Bagging-Based Logistic Regression With Spark: A Medical Data Mining Method","By Jian Pan, Yiang Hua, Xingtian Liu, Zhiqiang Chen, Zhaofeng Yan. 2016","Published in Proceedings of the 2nd International Conference on Advances in Mechanical Engineering and Industrial Informatics (AMEII 2016).","Bagging-Based Logistic Regression With Spark: A Medical Data Mining Method","https://api.semanticscholar.org/CorpusID:55949362"
"1778828826-10","https://archive.ics.uci.edu/dataset/17/breast+cancer+wisconsin+diagnostic","","A Sampling Kaczmarz-Motzkin Algorithm for Linear Feasibility","By Jesus Loera, Jamie Haddock, Deanna Needell. 2016","Published in SIAM J. Scientific Computing.","A Sampling Kaczmarz-Motzkin Algorithm for Linear Feasibility","https://api.semanticscholar.org/CorpusID:12442460"
"1778828826-11","https://archive.ics.uci.edu/dataset/17/breast+cancer+wisconsin+diagnostic","","A genetic programming approach to oral cancer prognosis","By Mei Tan, Jing Tan, Siow-Wee Chang, Hwa Yap, Sameem Abdul Kareem, Rosnah Zain. 2016","Published in PeerJ.","A genetic programming approach to oral cancer prognosis","https://api.semanticscholar.org/CorpusID:1506999"
"1778828826-12","https://archive.ics.uci.edu/dataset/17/breast+cancer+wisconsin+diagnostic","","A New Algorithm to Optimize Maximal Information Coefficient","By Yuan Chen, Ying Zeng, Feng Luo, Zheming Yuan. 2016","Published in PloS one.","A New Algorithm to Optimize Maximal Information Coefficient","https://api.semanticscholar.org/CorpusID:12264534"
"1778828826-13","https://archive.ics.uci.edu/dataset/17/breast+cancer+wisconsin+diagnostic","","Bias-variance decomposition in Genetic Programming","By Taras Kowaliw, René Doursat. 2016","Published in Open Mathematics.","Bias-variance decomposition in Genetic Programming","https://api.semanticscholar.org/CorpusID:41287763"
"1778828826-14","https://archive.ics.uci.edu/dataset/17/breast+cancer+wisconsin+diagnostic","","Model Selection and Overfitting in Genetic Programming: Empirical Study [Extended Version]","By Jan vZegklitz, Petr Povs'ik. 2015","Published in ArXiv.","Model Selection and Overfitting in Genetic Programming: Empirical Study [Extended Version]","https://api.semanticscholar.org/CorpusID:627183"
"1778828826-15","https://archive.ics.uci.edu/dataset/17/breast+cancer+wisconsin+diagnostic","","Semisupervised Tangent Space Discriminant Analysis","By Yang Zhou, Shiliang Sun. 2015","Published in Mathematical Problems in Engineering.","Semisupervised Tangent Space Discriminant Analysis","https://api.semanticscholar.org/CorpusID:51827293"
"1778828826-16","https://archive.ics.uci.edu/dataset/17/breast+cancer+wisconsin+diagnostic","","Constrained Extreme Learning Machines: A Study on Classification Cases","By Wentao Zhu, Jun Miao, Laiyun Qing. 2015","Published in ArXiv.","Constrained Extreme Learning Machines: A Study on Classification Cases","https://api.semanticscholar.org/CorpusID:5984495"
"1778828826-17","https://archive.ics.uci.edu/dataset/17/breast+cancer+wisconsin+diagnostic","","Model Selection and Overfitting in Genetic Programming: Empirical Study [Extended Version]","By Jan vZegklitz, Petr Povs'ik. 2015","Published in ArXiv.","Model Selection and Overfitting in Genetic Programming: Empirical Study [Extended Version]","https://api.semanticscholar.org/CorpusID:627183"
"1778828826-18","https://archive.ics.uci.edu/dataset/17/breast+cancer+wisconsin+diagnostic","","Active Learning Via Sequential Design and Uncertainty Sampling","By Jing Wang, Eunsik Park, Yuan-chin Chang. 2014","Published in","Active Learning Via Sequential Design and Uncertainty Sampling","https://api.semanticscholar.org/CorpusID:60446966"
"1778828826-19","https://archive.ics.uci.edu/dataset/17/breast+cancer+wisconsin+diagnostic","","Performance of Resampling Methods Based on Decision Trees, Parametric and Nonparametric Bayesian Classifiers for Three Medical Datasets","By Małgorzata Ćwiklińska-Jurkowska. 2013","Published in Studies in Logic, Grammar and Rhetoric.","Performance of Resampling Methods Based on Decision Trees, Parametric and Nonparametric Bayesian Classifiers for Three Medical Datasets","https://api.semanticscholar.org/CorpusID:73560660"
"1778828826-20","https://archive.ics.uci.edu/dataset/17/breast+cancer+wisconsin+diagnostic","","An Ensemble-Based Feature Selection Algorithm Using Combination of Support Vector Machine and Filter Methods for Solving Classification Problems","By Lev Utkin, Yulia Zhuk, Anatoly Chekh. 2013","Published in European Journal of Technology and Design.","An Ensemble-Based Feature Selection Algorithm Using Combination of Support Vector Machine and Filter Methods for Solving Classification Problems","https://api.semanticscholar.org/CorpusID:55415889"
"1778828826-21","https://archive.ics.uci.edu/dataset/17/breast+cancer+wisconsin+diagnostic","","Probabilistic Classification using Fuzzy Support Vector Machines","By Marzieh Parandehgheibi. 2013","Published in ArXiv.","Probabilistic Classification using Fuzzy Support Vector Machines","https://api.semanticscholar.org/CorpusID:17590418"
"1778828826-22","https://archive.ics.uci.edu/dataset/17/breast+cancer+wisconsin+diagnostic","","On the Success Rate of Crossover Operators for Genetic Programming with Offspring Selection","By Gabriel Kronberger, Stephan Winkler, Michael Affenzeller, Andreas Beham, Stefan Wagner. 2013","Published in Computer Aided Systems Theory - EUROCAST 2009, Lecture Notes in Computer Science Volume 5717, 2009, pp 793-800, Springer.","On the Success Rate of Crossover Operators for Genetic Programming with Offspring Selection","https://api.semanticscholar.org/CorpusID:14002628"
"1778828826-23","https://archive.ics.uci.edu/dataset/17/breast+cancer+wisconsin+diagnostic","","HC-CART: A parallel system implementation of data mining classification and regression tree (CART) algorithm on a multi-FPGA system","By Grigorios Chrysos, Panagiotis Dagritzikos, Ioannis Papaefstathiou, Apostolos Dollas. 2013","Published in TACO.","HC-CART: A parallel system implementation of data mining classification and regression tree (CART) algorithm on a multi-FPGA system","https://api.semanticscholar.org/CorpusID:16346801"
"1778828826-24","https://archive.ics.uci.edu/dataset/17/breast+cancer+wisconsin+diagnostic","","Identifying Finite Mixtures of Nonparametric Product Distributions and Causal Inference of Confounders","By Eleni Sgouritsa, Dominik Janzing, Jonas Peters, Bernhard Schoelkopf. 2013","Published in ArXiv.","Identifying Finite Mixtures of Nonparametric Product Distributions and Causal Inference of Confounders","https://api.semanticscholar.org/CorpusID:12506300"
"1778828826-25","https://archive.ics.uci.edu/dataset/17/breast+cancer+wisconsin+diagnostic","","Model-Based Clustering of High-Dimensional Data: A review","By Charles Bouveyron, Camille Brunet. 2012","Published in Computational Statistics & Data Analysis.","Model-Based Clustering of High-Dimensional Data: A review","https://api.semanticscholar.org/CorpusID:9107727"
"1778828826-26","https://archive.ics.uci.edu/dataset/17/breast+cancer+wisconsin+diagnostic","","MLiT: mixtures of Gaussians under linear transformations","By Ahmed Otoom, Hatice Gunes, Oscar Concha, Massimo Piccardi. 2011","Published in Pattern Analysis and Applications.","MLiT: mixtures of Gaussians under linear transformations","https://api.semanticscholar.org/CorpusID:21381399"
"1778828826-27","https://archive.ics.uci.edu/dataset/17/breast+cancer+wisconsin+diagnostic","","A novel feature selection approach for biomedical data classification.","By Yonghong Peng, Zhiqing Wu, Jianmin Jiang. 2010","Published in Journal of biomedical informatics.","A novel feature selection approach for biomedical data classification.","https://api.semanticscholar.org/CorpusID:1710466"
"1778828826-28","https://archive.ics.uci.edu/dataset/17/breast+cancer+wisconsin+diagnostic","","Bregman Distance to L1 Regularized Logistic Regression","By Mithun Gupta, Thomas Huang. 2010","Published in ArXiv.","Bregman Distance to L1 Regularized Logistic Regression","https://api.semanticscholar.org/CorpusID:10190207"
"1778828826-29","https://archive.ics.uci.edu/dataset/17/breast+cancer+wisconsin+diagnostic","","Mixtures of Gaussian Distributions under Linear Dimensionality Reduction","By Ahmed Otoom, Óscar Pérez, Massimo Piccardi. 2010","Published in VISAPP.","Mixtures of Gaussian Distributions under Linear Dimensionality Reduction","https://api.semanticscholar.org/CorpusID:5139641"
"1778828826-30","https://archive.ics.uci.edu/dataset/17/breast+cancer+wisconsin+diagnostic","","Ordinal Risk-Group Classification","By Yizhar Toren. 2010","Published in","Ordinal Risk-Group Classification","https://api.semanticscholar.org/CorpusID:88511693"
"1778828826-31","https://archive.ics.uci.edu/dataset/17/breast+cancer+wisconsin+diagnostic","","Particle swarm optimisation for outlier detection","By Ammar Mohemmed, Mengjie Zhang, Will Browne. 2010","Published in GECCO '10.","Particle swarm optimisation for outlier detection","https://api.semanticscholar.org/CorpusID:9191773"
"1778828826-32","https://archive.ics.uci.edu/dataset/17/breast+cancer+wisconsin+diagnostic","","Learning Classifier Systems: A Complete Introduction, Review, and Roadmap","By Ryan Urbanowicz, Jason Moore. 2009","Published in Journal of Artificial Evolution and Applications.","Learning Classifier Systems: A Complete Introduction, Review, and Roadmap","https://api.semanticscholar.org/CorpusID:1252660"
"1778828826-33","https://archive.ics.uci.edu/dataset/17/breast+cancer+wisconsin+diagnostic","","Learning to classify with missing and corrupted features","By Ofer Dekel, Ohad Shamir, Lin Xiao. 2009","Published in Machine Learning.","Learning to classify with missing and corrupted features","https://api.semanticscholar.org/CorpusID:259138"
"1778828826-34","https://archive.ics.uci.edu/dataset/17/breast+cancer+wisconsin+diagnostic","","Multi-group support vector machines with measurement costs: A biobjective approach","By Emilio Carrizosa, Belen Martin-Barragan, Dolores Morales. 2008","Published in Discrete Applied Mathematics.","Multi-group support vector machines with measurement costs: A biobjective approach","https://api.semanticscholar.org/CorpusID:7985533"
"1778828826-35","https://archive.ics.uci.edu/dataset/17/breast+cancer+wisconsin+diagnostic","","An analysis of constructive crossover and selection pressure in genetic programming","By Huayang Xie, Mengjie Zhang, Peter Andreae. 2007","Published in GECCO '07.","An analysis of constructive crossover and selection pressure in genetic programming","https://api.semanticscholar.org/CorpusID:10353384"
"1778828826-36","https://archive.ics.uci.edu/dataset/17/breast+cancer+wisconsin+diagnostic","","Support Vector Based Prototype Selection Method for Nearest Neighbor Rules","By Yuangui Li, Zhonghui Hu, Yunze Cai, Weidong Zhang. 2005","Published in ICNC.","Support Vector Based Prototype Selection Method for Nearest Neighbor Rules","https://api.semanticscholar.org/CorpusID:9409044"
